{
  "protocol": "emote/1",
  "kind": "frame",
  "seq": 4412,
  "source": {
    "id": "codex",
    "session": "local-task-01",
    "sent_at_ms": 1788558000123
  },
  "surface_id": "youandeye-desk-01",
  "affect": {
    "state": "thinking",
    "intensity": 0.7,
    "valence": 0.1,
    "arousal": 0.5
  },
  "behavior": {
    "mode": "attentive",
    "autonomy": true,
    "energy": 0.42,
    "engagement": 0.68,
    "speaking": 0
  },
  "gaze": {"target": "away"},
  "utterance": {
    "text": "PLEASE WAIT...",
    "mode": "scroll",
    "sound": "processing"
  },
  "channel_policy": {
    "eyes": "render",
    "utterance": "render",
    "audio": "auto"
  },
  "ttl_ms": 4000,
  "decay": {"curve": "ease_out", "duration_ms": 1200},
  "priority": "normal",
  "cause": "running local search",
  "trace_id": "trace-4412"
}
